"1","1","Delectus ipsam corporis neque non eum nemo. Voluptatem maiores laborum iure sit facilis. Facere reru","1997-03-23 09:57:30","1988-04-21 12:41:16","2012-07-12 18:49:33","2013-10-16 23:14:23",
"2","2","Qui voluptatibus iure sint repellendus aut. Fuga quas dolorem porro blanditiis id. Numquam qui fuga ","2011-04-24 08:41:52","1970-09-22 09:01:22","2018-04-29 02:36:15","2020-12-24 14:19:47",
"3","3","Modi tempora omnis nobis quisquam deleniti aliquid. Et molestiae dolor beatae adipisci dolor alias u","1991-05-08 09:20:05","1997-08-08 00:50:17","1984-05-05 07:07:19","1998-09-15 19:05:12",
"4","4","Nam vel vel officiis error ullam error repellat fugit. Non iste neque incidunt nesciunt et et harum.","2002-04-09 21:35:11","1980-07-05 07:37:41","1994-11-25 18:47:52","2016-02-28 02:48:48",
"5","5","Eius repellendus sed magni dolorem nihil delectus eligendi. Odio dolor ab provident. Vel ut et aut q","1981-01-22 18:23:50","2014-03-09 01:33:58","2016-08-17 11:41:50","1992-04-19 13:39:40",
"6","6","Maiores reprehenderit labore aperiam enim. Eligendi molestiae aut mollitia sint quidem quo aut. Illo","1976-05-11 21:14:10","1981-11-04 14:53:37","2000-07-17 20:59:42","2006-09-20 04:05:40",
"7","7","Est earum dolor ipsam iusto eum esse soluta. Eum qui aliquid ducimus quasi distinctio aliquam.","1988-01-19 13:59:54","1991-06-24 14:32:27","2005-04-15 09:00:00","2018-10-07 08:47:07",
"8","8","Eos est consectetur in itaque non. Quibusdam nemo nihil nesciunt. Consequatur voluptatum vitae sunt ","1986-12-13 13:35:11","1993-09-25 20:41:50","1980-01-26 00:41:39","2017-06-29 20:59:12",
"9","9","Minus temporibus deserunt accusamus maiores qui. Reiciendis hic sint quasi. Nostrum animi provident ","2021-01-07 20:08:51","1995-08-18 05:08:59","2002-10-20 02:51:13","2014-11-08 11:29:38",
"10","10","Ducimus sit qui eligendi. Ex quia rem dolores modi voluptatum mollitia.","2019-09-15 11:43:39","1970-12-04 00:53:48","1983-02-04 12:39:23","1980-04-30 18:25:55",
"11","11","Ratione qui at voluptatem velit. Molestias vero incidunt itaque. Cumque sequi excepturi ad quis repu","1979-12-13 05:56:07","1980-12-21 10:35:41","2009-08-14 07:56:04","1995-07-06 16:20:39",
"12","12","Sit aspernatur et eveniet quaerat. Aliquam vel ab mollitia neque. Veniam sit accusamus ut.","2003-09-17 00:54:17","1989-08-17 14:08:36","1977-04-20 12:24:56","1983-06-18 03:43:49",
"13","13","Voluptate sit repellat est et ex quidem maxime. Eveniet dolore vitae ut est aut. Temporibus magni po","1993-11-09 19:49:00","1987-10-27 19:17:56","2013-04-12 15:51:57","1998-10-02 01:30:36",
"14","14","Dolorum quia rerum rerum autem pariatur autem eum. Laboriosam sunt velit optio doloribus provident i","1992-08-27 19:58:52","2004-06-13 04:13:06","2001-12-23 22:45:54","2005-07-29 20:44:57",
"15","15","Et cumque aut illum quibusdam cumque dolore voluptatum. Suscipit repellendus quidem qui maxime esse ","2000-01-21 12:31:57","2004-03-15 21:43:01","2009-11-24 05:34:34","2003-04-04 09:31:14",
"16","16","Asperiores corporis ut omnis asperiores possimus. Ut voluptas placeat reprehenderit aut. Recusandae ","1978-11-01 07:17:31","2004-06-08 17:34:19","2018-08-06 01:08:52","1986-01-22 13:30:54",
"17","17","Dolorem eum at ratione rerum soluta dolores. Illum aut doloremque impedit error repellendus. Illum m","2013-02-01 11:23:39","1977-07-29 21:50:24","1985-04-29 06:01:49","1998-10-05 09:34:56",
"18","18","Rem amet voluptatem recusandae id vel minus voluptatem fuga. Voluptatibus consequatur est accusantiu","1987-02-01 06:57:30","2005-06-14 11:30:30","2011-08-10 12:12:37","2012-03-14 16:03:37",
"19","19","Sed maiores voluptatem reprehenderit fugiat dolores. Iste sed rerum nesciunt quo. Vel explicabo aliq","2002-04-26 15:58:18","1995-10-30 23:18:28","1994-08-29 22:08:32","1982-08-03 20:52:00",
"20","20","Sint sed sequi ea molestias quidem sit. Quaerat et ut ipsam. Velit quis ut modi velit at ex.","1982-09-15 08:18:42","1987-06-04 13:15:31","1998-09-20 17:33:10","1989-04-14 05:32:45",
